{
  "schema_version": "1",
  "provider_id": "external.mcp.browser.open_page",
  "provider_class": "external",
  "kind": "mcp",
  "risk": "network_active",
  "side_effects": ["network"],
  "transport": "http",
  "downstream_identity": "browser-mcp",
  "tool_identity": "open_page",
  "declared_permissions": ["network"],
  "allowed_origins": ["https://example.com"],
  "schema_pin": {
    "algorithm": "sha256",
    "digest": "sha256:a2c799262a3ce3c19ef5cdd983bf3d12b43ab3c426227091b909dcb7054738c0",
    "schema": {
      "type": "object"
    }
  },
  "observed_schema": {
    "type": "object"
  }
}
